{
  "schema_version": "1.0.0",
  "audited_at": "2026-09-30T12:00:00+07:00",
  "policy_version": "PHASE_1D_V1",
  "sources": [
    {
      "source_id": "e584d083-4d90-440e-99ae-bac7264dbb59",
      "source_key": "jaklingko-indonesia-application-and-partnership",
      "publisher": "PT JakLingko Indonesia",
      "official_url": "https://www.jaklingkoindonesia.co.id/app",
      "service_type": "Official multimodal passenger application and partnership channel",
      "classification": "PARTNERSHIP_REQUIRED",
      "documented_api": "FALSE",
      "public_access": "FALSE",
      "authentication_requirement": "UNKNOWN",
      "automation_status": "PARTNERSHIP_REQUIRED",
      "reuse_redistribution_status": "UNKNOWN",
      "freshness": "Application advertises real-time information, but no public machine-feed cadence or TTL is documented.",
      "capabilities": {
        "static_schedule": "TRUE",
        "live_position": "UNKNOWN",
        "eta": "TRUE",
        "service_alert": "TRUE",
        "station_status": "UNKNOWN",
        "stop_status": "UNKNOWN",
        "route_status": "UNKNOWN",
        "disruption_event": "TRUE"
      },
      "integration_route": "Request a read-only academic/partner interface through JLI's official community and academic partnership channel; do not infer private application endpoints.",
      "implementation_status": "REGISTRY_ONLY",
      "evidence": [
        "https://www.jaklingkoindonesia.co.id/app",
        "https://mail.jaklingkoindonesia.co.id/kemitraan"
      ]
    },
    {
      "source_id": "e0e9a4bf-bc29-53ce-a004-b95b26f1cfde",
      "source_key": "transjakarta-official-operational-information",
      "publisher": "PT Transportasi Jakarta",
      "official_url": "https://transjakarta.co.id/news",
      "service_type": "Official public service updates and passenger application",
      "classification": "VERIFIED_PUBLIC_INFORMATION",
      "documented_api": "FALSE",
      "public_access": "TRUE",
      "authentication_requirement": "NONE",
      "automation_status": "UNKNOWN",
      "reuse_redistribution_status": "UNKNOWN",
      "freshness": "Per-publication timestamps; no official machine-feed cadence or default TTL established.",
      "capabilities": {
        "static_schedule": "TRUE",
        "live_position": "UNKNOWN",
        "eta": "TRUE",
        "service_alert": "TRUE",
        "station_status": "UNKNOWN",
        "stop_status": "UNKNOWN",
        "route_status": "TRUE",
        "disruption_event": "TRUE"
      },
      "integration_route": "Official public information can enter AI-01 only as a reviewable candidate; machine integration requires an official documented or partner interface.",
      "implementation_status": "REGISTRY_ONLY",
      "evidence": [
        "https://transjakarta.co.id/news/jakarta-sky-fun-run-2026-jadi-momentum-transjakarta-kampanyekan-mobilitas-berkelanjutan-dan-luncurkan-aplikasi-tjtransjakarta-300",
        "https://ppid.transjakarta.co.id/informasi/berkala"
      ]
    },
    {
      "source_id": "7dd428de-2ed9-51ce-bb86-88d69c3e503b",
      "source_key": "kai-commuter-official-operational-information",
      "publisher": "PT Kereta Commuter Indonesia",
      "official_url": "https://www.commuterline.id/informasi-publik/berita",
      "service_type": "Official public information and passenger application",
      "classification": "VERIFIED_PUBLIC_INFORMATION",
      "documented_api": "FALSE",
      "public_access": "TRUE",
      "authentication_requirement": "UNKNOWN",
      "automation_status": "UNKNOWN",
      "reuse_redistribution_status": "UNKNOWN",
      "freshness": "Per-publication/application update; no public machine contract or TTL documented.",
      "capabilities": {
        "static_schedule": "TRUE",
        "live_position": "TRUE",
        "eta": "TRUE",
        "service_alert": "TRUE",
        "station_status": "UNKNOWN",
        "stop_status": "FALSE",
        "route_status": "TRUE",
        "disruption_event": "TRUE"
      },
      "integration_route": "Use official public/operator-confirmed fallback; request documented read-only access for automation.",
      "implementation_status": "REGISTRY_ONLY",
      "evidence": [
        "https://www.commuterline.id/informasi-publik/berita",
        "https://www.commuterline.id/perusahaan/informasi-umum"
      ]
    },
    {
      "source_id": "456ac0e7-15d6-5c32-97d6-910dd763398c",
      "source_key": "mrt-jakarta-official-operational-information",
      "publisher": "PT MRT Jakarta (Perseroda)",
      "official_url": "https://www.jakartamrt.co.id/id/info-terkini",
      "service_type": "Official public information and passenger service",
      "classification": "VERIFIED_PUBLIC_INFORMATION",
      "documented_api": "FALSE",
      "public_access": "TRUE",
      "authentication_requirement": "NONE",
      "automation_status": "UNKNOWN",
      "reuse_redistribution_status": "UNKNOWN",
      "freshness": "Per-publication timestamps; no public machine contract or TTL documented.",
      "capabilities": {
        "static_schedule": "TRUE",
        "live_position": "UNKNOWN",
        "eta": "UNKNOWN",
        "service_alert": "TRUE",
        "station_status": "UNKNOWN",
        "stop_status": "FALSE",
        "route_status": "TRUE",
        "disruption_event": "TRUE"
      },
      "integration_route": "Use official public/operator-confirmed fallback; request documented read-only access for automation.",
      "implementation_status": "REGISTRY_ONLY",
      "evidence": [
        "https://www.jakartamrt.co.id/id/info-terkini",
        "https://www.jakartamrt.co.id/id/jadwal-keberangkatan-mrt",
        "https://www.jakartamrt.co.id/id/peringatandisclaimer"
      ]
    },
    {
      "source_id": "2fbe633a-78e9-5eff-beed-ab26ada05f17",
      "source_key": "lrt-jakarta-official-operational-information",
      "publisher": "PT LRT Jakarta",
      "official_url": "https://www.lrtjakarta.co.id/",
      "service_type": "Official public information and passenger service",
      "classification": "VERIFIED_PUBLIC_INFORMATION",
      "documented_api": "FALSE",
      "public_access": "TRUE",
      "authentication_requirement": "NONE",
      "automation_status": "UNKNOWN",
      "reuse_redistribution_status": "UNKNOWN",
      "freshness": "Per-publication timestamps; no public machine contract or TTL documented.",
      "capabilities": {
        "static_schedule": "TRUE",
        "live_position": "UNKNOWN",
        "eta": "UNKNOWN",
        "service_alert": "TRUE",
        "station_status": "UNKNOWN",
        "stop_status": "FALSE",
        "route_status": "TRUE",
        "disruption_event": "TRUE"
      },
      "integration_route": "Use official public/operator-confirmed fallback; pursue the documented inter-operator data collaboration or a direct academic agreement.",
      "implementation_status": "REGISTRY_ONLY",
      "evidence": [
        "https://www.lrtjakarta.co.id/",
        "https://mail.lrtjakarta.co.id/lrt_jakarta_perkuat_resiliensi_transportasi_publik_melalui_kolaborasi_lintas_operator_pers480.html"
      ]
    },
    {
      "source_id": "5c7cdbbf-d875-5872-ab80-b8ff91c6c108",
      "source_key": "lrt-jabodebek-official-operational-information",
      "publisher": "PT Kereta Api Indonesia (Persero) / LRT Jabodebek",
      "official_url": "https://lrtjabodebek.kai.id/",
      "service_type": "Official public information and passenger service",
      "classification": "VERIFIED_PUBLIC_INFORMATION",
      "documented_api": "FALSE",
      "public_access": "TRUE",
      "authentication_requirement": "NONE",
      "automation_status": "UNKNOWN",
      "reuse_redistribution_status": "UNKNOWN",
      "freshness": "Per-publication timestamps; no public machine contract or TTL documented.",
      "capabilities": {
        "static_schedule": "TRUE",
        "live_position": "UNKNOWN",
        "eta": "UNKNOWN",
        "service_alert": "TRUE",
        "station_status": "UNKNOWN",
        "stop_status": "FALSE",
        "route_status": "TRUE",
        "disruption_event": "TRUE"
      },
      "integration_route": "Use official public/operator-confirmed fallback; request documented read-only access from KAI/LRT Jabodebek.",
      "implementation_status": "REGISTRY_ONLY",
      "evidence": [
        "https://lrtjabodebek.kai.id/",
        "https://www.kai.id/information/full_news"
      ]
    },
    {
      "source_id": "a129327c-e4cd-400b-a55d-c8577f95c404",
      "source_key": "petabencana-public-flood-api",
      "publisher": "Yayasan Peta Bencana / Disaster Map Foundation",
      "official_url": "https://docs.petabencana.id/routes/area-banjir",
      "service_type": "Documented public flood-observation API",
      "classification": "VERIFIED_PUBLIC_API",
      "documented_api": "TRUE",
      "public_access": "TRUE",
      "authentication_requirement": "NONE",
      "automation_status": "PERMITTED",
      "reuse_redistribution_status": "PERMITTED",
      "freshness": "CAP flood-area records use the documented default six-hour expiry; every record is still evaluated by expires_at.",
      "capabilities": {
        "static_schedule": "FALSE",
        "live_position": "FALSE",
        "eta": "FALSE",
        "service_alert": "FALSE",
        "station_status": "FALSE",
        "stop_status": "FALSE",
        "route_status": "FALSE",
        "disruption_event": "TRUE"
      },
      "integration_route": "Implemented documented read-only adapter; flood observations remain environmental evidence and cannot assert transport closure.",
      "implementation_status": "ADAPTER_IMPLEMENTED",
      "evidence": [
        "https://docs.petabencana.id/routes/area-banjir",
        "https://github.com/petabencana/petabencana-meta/blob/master/petabencana.id/LICENSING.md"
      ]
    },
    {
      "source_id": "b14ca6d6-84f1-440e-b667-8def934353b7",
      "source_key": "bpbd-dki-official-flood-information",
      "publisher": "BPBD Provinsi DKI Jakarta",